{
  "$schema": "https://json-schema.org/draft/2020-12/schema",
  "$id": "https://github.com/AzzoDude/xcelerate/docs/plugins/plugin.schema.json",
  "title": "xcelerate plugin manifest",
  "description": "Declarative manifest for an xcelerate plugin. Manifests are validated by the host before any plugin code runs.",
  "type": "object",
  "additionalProperties": false,
  "required": ["name", "version", "host_api", "entrypoint", "ops"],
  "properties": {
    "name": {
      "type": "string",
      "minLength": 1,
      "pattern": "^[A-Za-z0-9._-]+$",
      "description": "Unique plugin id. May not shadow a reserved plugin name."
    },
    "version": {
      "type": "string",
      "minLength": 1,
      "description": "Plugin version (semver recommended)."
    },
    "host_api": {
      "type": "string",
      "minLength": 1,
      "description": "Host interface range this plugin targets, e.g. '>=1.0 <2.0'."
    },
    "entrypoint": {
      "type": "string",
      "minLength": 1,
      "description": "Path to the sandboxed program, relative to the manifest."
    },
    "abi": {
      "type": "string",
      "minLength": 1,
      "description": "Sandbox ABI the plugin speaks, e.g. 'wasm32-wasip2/1'."
    },
    "ops": {
      "type": "array",
      "minItems": 1,
      "uniqueItems": true,
      "items": { "type": "string", "minLength": 1 },
      "description": "Operations exposed through PluginHandle::invoke."
    },
    "capabilities": {
      "type": "array",
      "uniqueItems": true,
      "items": { "$ref": "#/$defs/capability" },
      "description": "Capabilities requested. Default-deny; host-only capabilities are rejected."
    },
    "dependencies": {
      "type": "object",
      "description": "Other plugins this one depends on, as plugin name -> version range. Resolved and loaded before this plugin; each remains independently sandboxed and granted.",
      "additionalProperties": { "type": "string", "minLength": 1 }
    },
    "limits": {
      "type": "object",
      "additionalProperties": false,
      "description": "Per-invocation resource budgets, clamped to the host maxima.",
      "properties": {
        "max_invoke_millis": {
          "type": "integer",
          "minimum": 1,
          "maximum": 30000,
          "default": 30000
        },
        "max_response_bytes": {
          "type": "integer",
          "minimum": 1,
          "maximum": 1048576,
          "default": 1048576
        }
      }
    }
  },
  "$defs": {
    "capability": {
      "enum": [
        "navigate",
        "query",
        "click",
        "fill",
        "type_keys",
        "wait_for",
        "wait_for_navigation",
        "get_text",
        "get_attribute",
        "evaluate",
        "cdp_proxy",
        "read_cookies",
        "write_cookies",
        "init_script",
        "screenshot",
        "network_capture",
        "launch_control",
        "binary_patch",
        "detached_spawn"
      ]
    }
  }
}
