{
  "name": "acme.notes",
  "version": "1.0.0",
  "host_api": ">=1.0 <2.0",
  "entrypoint": "notes.wasm",
  "abi": "wasm32-wasip2/1",
  "ops": ["save", "load", "list"],
  "capabilities": [],
  "dependencies": { "acme.kv": "^1.0" },
  "limits": { "max_invoke_millis": 5000, "max_response_bytes": 65536 }
}
